{
  "format": "palo-semantic-mapping-registry",
  "schemaVersion": "1.0.0",
  "semanticVersion": "3.0.0",
  "releasedAt": "2026-08-12",
  "status": "approved-for-release",
  "authorityBoundary": "Mappings express versioned PALO relationships and rationale. They do not establish legal equivalence, compliance, certification, or deployment authorization.",
  "mappings": [
    {
      "mappingId": "https://paloframework.org/semantic/mapping/control-to-gate/ctrl-adversarial-testing/assess",
      "mappingVersion": "1.0.0",
      "mappingType": "control-to-gate",
      "source": {
        "entityType": "control",
        "entityId": "ctrl-adversarial-testing",
        "semanticId": "https://paloframework.org/semantic/control/ctrl-adversarial-testing?v=3.0.0",
        "version": "3.0.0"
      },
      "target": {
        "entityType": "gate",
        "entityId": "assess",
        "semanticId": "https://paloframework.org/semantic/gate/assess?v=3.0.0",
        "version": "3.0.0"
      },
      "coverageType": "conditional",
      "conditions": [
        "Confirm applicability and ownership for the actual case."
      ],
      "rationale": "The control is relevant to the named gate when the case scope activates it.",
      "basis": "Declared relationship in data/control-library.json; no legal-equivalence or compliance claim is created.",
      "approval": {
        "status": "approved",
        "scope": "PALO framework publication only; not a legal applicability or certification decision.",
        "decidedAt": "2026-08-12T08:00:00Z",
        "decidedBy": "PALO framework release process"
      },
      "validFrom": "2026-08-12T00:00:00Z",
      "provenance": {
        "generatedFrom": "data/control-library.json",
        "generationRule": "control-to-gate: one immutable source-target pair per declared ID reference."
      }
    },
    {
      "mappingId": "https://paloframework.org/semantic/mapping/control-to-gate/ctrl-adversarial-testing/measure",
      "mappingVersion": "1.0.0",
      "mappingType": "control-to-gate",
      "source": {
        "entityType": "control",
        "entityId": "ctrl-adversarial-testing",
        "semanticId": "https://paloframework.org/semantic/control/ctrl-adversarial-testing?v=3.0.0",
        "version": "3.0.0"
      },
      "target": {
        "entityType": "gate",
        "entityId": "measure",
        "semanticId": "https://paloframework.org/semantic/gate/measure?v=3.0.0",
        "version": "3.0.0"
      },
      "coverageType": "conditional",
      "conditions": [
        "Confirm applicability and ownership for the actual case."
      ],
      "rationale": "The control is relevant to the named gate when the case scope activates it.",
      "basis": "Declared relationship in data/control-library.json; no legal-equivalence or compliance claim is created.",
      "approval": {
        "status": "approved",
        "scope": "PALO framework publication only; not a legal applicability or certification decision.",
        "decidedAt": "2026-08-12T08:00:00Z",
        "decidedBy": "PALO framework release process"
      },
      "validFrom": "2026-08-12T00:00:00Z",
      "provenance": {
        "generatedFrom": "data/control-library.json",
        "generationRule": "control-to-gate: one immutable source-target pair per declared ID reference."
      }
    },
    {
      "mappingId": "https://paloframework.org/semantic/mapping/control-to-gate/ctrl-adversarial-testing/prove",
      "mappingVersion": "1.0.0",
      "mappingType": "control-to-gate",
      "source": {
        "entityType": "control",
        "entityId": "ctrl-adversarial-testing",
        "semanticId": "https://paloframework.org/semantic/control/ctrl-adversarial-testing?v=3.0.0",
        "version": "3.0.0"
      },
      "target": {
        "entityType": "gate",
        "entityId": "prove",
        "semanticId": "https://paloframework.org/semantic/gate/prove?v=3.0.0",
        "version": "3.0.0"
      },
      "coverageType": "conditional",
      "conditions": [
        "Confirm applicability and ownership for the actual case."
      ],
      "rationale": "The control is relevant to the named gate when the case scope activates it.",
      "basis": "Declared relationship in data/control-library.json; no legal-equivalence or compliance claim is created.",
      "approval": {
        "status": "approved",
        "scope": "PALO framework publication only; not a legal applicability or certification decision.",
        "decidedAt": "2026-08-12T08:00:00Z",
        "decidedBy": "PALO framework release process"
      },
      "validFrom": "2026-08-12T00:00:00Z",
      "provenance": {
        "generatedFrom": "data/control-library.json",
        "generationRule": "control-to-gate: one immutable source-target pair per declared ID reference."
      }
    },
    {
      "mappingId": "https://paloframework.org/semantic/mapping/control-to-gate/ctrl-agentic-authority/assess",
      "mappingVersion": "1.0.0",
      "mappingType": "control-to-gate",
      "source": {
        "entityType": "control",
        "entityId": "ctrl-agentic-authority",
        "semanticId": "https://paloframework.org/semantic/control/ctrl-agentic-authority?v=3.0.0",
        "version": "3.0.0"
      },
      "target": {
        "entityType": "gate",
        "entityId": "assess",
        "semanticId": "https://paloframework.org/semantic/gate/assess?v=3.0.0",
        "version": "3.0.0"
      },
      "coverageType": "conditional",
      "conditions": [
        "Confirm applicability and ownership for the actual case."
      ],
      "rationale": "The control is relevant to the named gate when the case scope activates it.",
      "basis": "Declared relationship in data/control-library.json; no legal-equivalence or compliance claim is created.",
      "approval": {
        "status": "approved",
        "scope": "PALO framework publication only; not a legal applicability or certification decision.",
        "decidedAt": "2026-08-12T08:00:00Z",
        "decidedBy": "PALO framework release process"
      },
      "validFrom": "2026-08-12T00:00:00Z",
      "provenance": {
        "generatedFrom": "data/control-library.json",
        "generationRule": "control-to-gate: one immutable source-target pair per declared ID reference."
      }
    },
    {
      "mappingId": "https://paloframework.org/semantic/mapping/control-to-gate/ctrl-agentic-authority/control",
      "mappingVersion": "1.0.0",
      "mappingType": "control-to-gate",
      "source": {
        "entityType": "control",
        "entityId": "ctrl-agentic-authority",
        "semanticId": "https://paloframework.org/semantic/control/ctrl-agentic-authority?v=3.0.0",
        "version": "3.0.0"
      },
      "target": {
        "entityType": "gate",
        "entityId": "control",
        "semanticId": "https://paloframework.org/semantic/gate/control?v=3.0.0",
        "version": "3.0.0"
      },
      "coverageType": "conditional",
      "conditions": [
        "Confirm applicability and ownership for the actual case."
      ],
      "rationale": "The control is relevant to the named gate when the case scope activates it.",
      "basis": "Declared relationship in data/control-library.json; no legal-equivalence or compliance claim is created.",
      "approval": {
        "status": "approved",
        "scope": "PALO framework publication only; not a legal applicability or certification decision.",
        "decidedAt": "2026-08-12T08:00:00Z",
        "decidedBy": "PALO framework release process"
      },
      "validFrom": "2026-08-12T00:00:00Z",
      "provenance": {
        "generatedFrom": "data/control-library.json",
        "generationRule": "control-to-gate: one immutable source-target pair per declared ID reference."
      }
    },
    {
      "mappingId": "https://paloframework.org/semantic/mapping/control-to-gate/ctrl-change-gate/assess",
      "mappingVersion": "1.0.0",
      "mappingType": "control-to-gate",
      "source": {
        "entityType": "control",
        "entityId": "ctrl-change-gate",
        "semanticId": "https://paloframework.org/semantic/control/ctrl-change-gate?v=3.0.0",
        "version": "3.0.0"
      },
      "target": {
        "entityType": "gate",
        "entityId": "assess",
        "semanticId": "https://paloframework.org/semantic/gate/assess?v=3.0.0",
        "version": "3.0.0"
      },
      "coverageType": "conditional",
      "conditions": [
        "Confirm applicability and ownership for the actual case."
      ],
      "rationale": "The control is relevant to the named gate when the case scope activates it.",
      "basis": "Declared relationship in data/control-library.json; no legal-equivalence or compliance claim is created.",
      "approval": {
        "status": "approved",
        "scope": "PALO framework publication only; not a legal applicability or certification decision.",
        "decidedAt": "2026-08-12T08:00:00Z",
        "decidedBy": "PALO framework release process"
      },
      "validFrom": "2026-08-12T00:00:00Z",
      "provenance": {
        "generatedFrom": "data/control-library.json",
        "generationRule": "control-to-gate: one immutable source-target pair per declared ID reference."
      }
    },
    {
      "mappingId": "https://paloframework.org/semantic/mapping/control-to-gate/ctrl-change-gate/classify",
      "mappingVersion": "1.0.0",
      "mappingType": "control-to-gate",
      "source": {
        "entityType": "control",
        "entityId": "ctrl-change-gate",
        "semanticId": "https://paloframework.org/semantic/control/ctrl-change-gate?v=3.0.0",
        "version": "3.0.0"
      },
      "target": {
        "entityType": "gate",
        "entityId": "classify",
        "semanticId": "https://paloframework.org/semantic/gate/classify?v=3.0.0",
        "version": "3.0.0"
      },
      "coverageType": "conditional",
      "conditions": [
        "Confirm applicability and ownership for the actual case."
      ],